{
  "method": "lookup_table",
  "complete_for": "[[3,1,3]] bit-flip code; single independent X on one physical qubit; lookup decoder",
  "syndrome_table_sha256": "4742bc113431bfbf33b90cb82c0e35c175273f28cf9a2d8e1371d7415a596646",
  "syndrome_table_path": "syndrome_table.json",
  "correction_table_sha256": "778d0168561335cf89dca2f5a37c24c004c4046d4d84fad51cefcb1b6384d73b",
  "correction_table_path": "correction_table.json"
}
